### ISSUE TITLE
Cant set TOS on packets

### ISSUE THREAD

**Issue by GoogleCodeExporter** [snowyu/libtorrent#265]
```
What steps will reproduce the problem?
1. settings.peer_tos = chr(0x20) (in python binding)
2. start 2 torrent daemons locally (ports 20000 and 20001) and download 1 
torrent in first daemon from second.
3. sudo tcpdump -vv -i lo tcp port 20000 or port 20001

What is the expected output? What do you see instead?
I would expect packets be marked by tos byte 0x20. But, tcpdumps shows:

14:31:30.111974 IP (tos 0x0, ttl 64, id 10009, offset 0, flags [DF], proto TCP 
(6), length 60) mocksoul.41327 > mocksoul.20000: S 561920986:561920986(0) win 
32792 <mss 16396,[|tcp]>
14:31:30.111985 IP (tos 0x0, ttl 64, id 0, offset 0, flags [DF], proto TCP (6), 
length 60) mocksoul.20000 > mocksoul.41327: S 559100185:559100185(0) ack 
561920987 win 32768 <mss 16396,[|tcp]>

As you can see - tos 0x0, so no marking was done.

What version of the product are you using? On what operating system?
Linux (gentoo) 2.6.38-5-zen
FreeBSD 7, FreeBSD 8 tested as well.
Libtorrent 0.15.6 and 0.15.8.

Please provide any additional information below.
I did tried to setsockopt in python simply:

mocksoul@mocksoul ~root/services/copier % cat ../../t.py
import socket

s = socket.socket(socket.AF_INET, socket.SOCK_STREAM)
s.setsockopt(socket.IPPROTO_IP, socket.IP_TOS, chr(0x20))
s.bind(('', 12345))
s.listen(1)

s2 = socket.socket(socket.AF_INET, socket.SOCK_STREAM)
s2.setsockopt(socket.IPPROTO_IP, socket.IP_TOS, 0x20)
s2.connect(('localhost', 12345))

s2.send('asddsa')
s1, addr = s.accept()

print s1.recv(6)

s2.close()
s1.close()
s.close()

And this sets proper TOS:

mocksoul /home/mocksoul # tcpdump -vv -i lo tcp port 12345
tcpdump: listening on lo, link-type EN10MB (Ethernet), capture size 68 bytes
14:37:55.649086 IP (tos 0x20, ttl 64, id 777, offset 0, flags [DF], proto TCP 
(6), length 60) mocksoul.yandex.55453 > mocksoul.yandex.12345: S 
2310667725:2310667725(0) win 32792 <mss 16396,[|tcp]>
14:37:55.649110 IP (tos 0x20, ttl 64, id 0, offset 0, flags [DF], proto TCP 
(6), length 60) mocksoul.yandex.12345 > mocksoul.yandex.55453: S 
2319086042:2319086042(0) ack 2310667726 win 32768 <mss 16396,[|tcp]>
14:37:55.649127 IP (tos 0x20, ttl 64, id 778, offset 0, flags [DF], proto TCP 
(6), length 52) mocksoul.yandex.55453 > mocksoul.yandex.12345: . 1:1(0) ack 1 
win 513 <nop,nop,timestamp[|tcp]>
14:37:55.649152 IP (tos 0x20, ttl 64, id 779, offset 0, flags [DF], proto TCP 
(6), length 58) mocksoul.yandex.55453 > mocksoul.yandex.12345: P 1:7(6) ack 1 
win 513 <nop,nop,timestamp[|tcp]>
14:37:55.649161 IP (tos 0x20, ttl 64, id 36639, offset 0, flags [DF], proto TCP 
(6), length 52) mocksoul.yandex.12345 > mocksoul.yandex.55453: . 1:1(0) ack 7 
win 512 <nop,nop,timestamp[|tcp]>
14:37:55.649229 IP (tos 0x20, ttl 64, id 780, offset 0, flags [DF], proto TCP 
(6), length 52) mocksoul.yandex.55453 > mocksoul.yandex.12345: F 7:7(0) ack 1 
win 513 <nop,nop,timestamp[|tcp]>
14:37:55.649245 IP (tos 0x20, ttl 64, id 36640, offset 0, flags [DF], proto TCP 
(6), length 52) mocksoul.yandex.12345 > mocksoul.yandex.55453: F 1:1(0) ack 8 
win 512 <nop,nop,timestamp[|tcp]>
14:37:55.649256 IP (tos 0x20, ttl 64, id 781, offset 0, flags [DF], proto TCP 
(6), length 52) mocksoul.yandex.55453 > mocksoul.yandex.12345: . 8:8(0) ack 2 
win 513 <nop,nop,timestamp[|tcp]>
^C
8 packets captured
16 packets received by filter
0 packets dropped by kernel

```

Original issue reported on code.google.com by `mocksoul` on 9 Nov 2011 at 10:40
